id,name,area,alternate_url,approved,archived,description,employer_name,employer_url,employment,experience,has_test,initial_created_at,premium,published_at,salary_from,salary_to,salary_currency,schedule,address_city,address_street,address_lat,address_lng
104713729,Разработчик Python junior,Екатеринбург,https://hh.ru/vacancy/104713729,True,False,"<p><strong>Привет! Мы ТМК++ (прием сотрудников осуществляется в АО &quot;ДИАЙПИ&quot; - это аккредитованная ИТ-компания внутри промышленного гиганта).</strong></p> <p>ТМК++ - сильная и перспективная команда разработчиков и высококлассных ИТ специалистов со всей России. Наша команда растет и набирает обороты, сегодня нас уже более 1000 человек.</p> <p>Сейчас мы в поисках<strong> разработчика Python.</strong></p> <p><strong>Чем Вам предстоит заниматься:</strong></p> <ul> <li>Разработка алгоритмов, направленных на повышение эффективности, оптимизации технологических бизнес-процессов производства;</li> <li>Написание тестов;</li> <li>Участие в проектах по разработке рекомендательных систем для металлургического производства.</li> </ul> <p><strong>Эта вакансия для Вас, если Вы:</strong></p> <ul> <li>Имеете или завершаете высшее образование в IT-направлении (Математика, АСУ)</li> <li>Знаете язык программирования Python 3;</li> <li>Умеете применять ООП;</li> </ul> <p><strong>Будет плюсом, если Вы:</strong></p> <ul> <li>Владеете языком запросов SQL;</li> <li>Знаете математические методы решения оптимизационных задач;</li> <li>Применяли HTML, CSS.</li> </ul> <p> </p> <p><strong>Что мы предлагаем:</strong></p> <ul> <li>Работу в сильной команде профессионалов;</li> <li>Удаленный формат работы, график 5/2;</li> <li>ДМС после прохождения испытательного срока;</li> <li>Обучение в корпоративном университете и на внешних профессиональных площадках;</li> <li>Официальное оформление, стабильные выплаты и премии по результатам работы;</li> <li>Белую заработную плату и расширенный соц. пакет;</li> <li>Возможность корпоративного изучения английского языка;</li> <li>Насыщенную корпоративную культуру и всю необходимую технику;</li> <li>Энергичную атмосферу и работу над крутыми и сложными проектами.</li> </ul> <p><strong>Присоединяйся к команде профессионалов!</strong></p>",Трубная Металлургическая Компания,https://hh.ru/employer/6131,Полная занятость,От 1 года до 3 лет,False,2024-07-26T12:59:39+0300,False,2024-07-26T12:59:39+0300,0.0,0.0,0,Удаленная работа,0,0,0.0,0.0
91972625,Инженер Linux,Екатеринбург,https://hh.ru/vacancy/91972625,True,False,"<p>Надёжный партнёр Группы компаний ХОСТ - российский разработчик в области кибербезопасности приглашает <em>Linux</em> инженера к сотрудничеству.</p> <p><strong>Задачи:</strong></p> <ul> <li>Установка и настройка средств защиты информации (собственные разработки компании) на территории заказчиков;</li> <li>Интеграция решений с существующими системами заказчиков;</li> <li>Доработка скриптов под задачи заказчика;</li> <li>Развертывание и обеспечение функционирования тестовой инфраструктуры продукта;</li> <li>Документирование и автоматизация процесса установки продукта;</li> </ul> <p><strong>Ожидания от кандидата:</strong></p> <ul> <li>Знание современных операционных систем на уровне администратора (MS Windows и GNU/<em>Linux</em>: Debian, Red-Hat-like);</li> <li>Опыт работы с СУБД (предпочтительно PostgreSQL);</li> <li>Знание технологий построения и протоколов базовых информационных сервисов (пример – DNS, NTP, LDAP, SNMP);</li> <li>Понимание работы сетевых протоколов (модель OSI, коммутация, маршрутизация).</li> <li>Готовность к редким командировкам.</li> </ul> <p><em><strong>Желательно:</strong></em></p> <ul> <li>Знание промышленных сетевых протоколов (Modbus, IEC-104);</li> <li>Знакомство со SCADA, PLC и другими компонентами систем промышленной</li> </ul> <p>автоматизации;</p> <ul> <li>Навыки программирования на языке <em>Python</em>;</li> <li>Опыт разработки проектной документации (ТЗ, технические проекты, ПМИ, и т.д.);</li> <li>Опыт развертывания и администрирования средств <em>мониторинг</em>а (<em>SIEM</em>, Zabbix).</li> </ul> <p><strong>Компания предлагает:</strong></p> <ul> <li>Трудоустройство согласно ТК РФ с первого рабочего дня, аккредитованная ИТ компания;</li> <li>Корпоративный трансфер и паркинг, уютный офис, отличный софт для работы;</li> <li>Конкурентоспособный уровень заработной платы;</li> <li>ДМС для сотрудников и для детей в лучших клиниках города с широким набором медицинских услуг;</li> <li>Корпоративный спорт и компенсация занятий спортом;</li> <li>Профильная сертификация по направлениям профессиональной деятельности;</li> <li>Корпоративный курс обучения английскому языку.</li> </ul> <p>Ждём Ваше резюме!</p>","ХОСТ, Группа компаний",https://hh.ru/employer/52511,Полная занятость,От 3 до 6 лет,False,2024-01-21T16:01:42+0300,False,2024-07-08T06:14:05+0300,150000.0,,RUR,Полный день,0,0,0.0,0.0
104638836,Разработчик Python,Екатеринбург,https://hh.ru/vacancy/104638836,True,False,"<p><em><strong>Привет!</strong></em></p> <p><em>Наша команда занимается разработкой платежных решений по всему миру.</em></p> <p><em>Мы ищем амбициозного разработчика, которому по душе, когда в работе присутствует:</em></p> <ul> <li><em>Атмосфера стартапа на поздних этапах - есть все бонусы в виде отсутствия бюрократии, быстроты принятий решений и возможностей для креатива. Но уже нет минусов в виде бардака и отсутствия четкого понимания целей;</em></li> <li><em>Отсутствие иерархии и работа напрямую с фаундерами - у тебя будет уникальная возможность участвовать в создании продукта и влиять на конечный результат.</em></li> </ul> <p>Давай расскажем подробнее...</p> <p><strong>Чем предстоит заниматься:</strong></p> <ul> <li>Продумывание и разработка бизнес-логики приложения платежной системы на Python;</li> <li>Развитие API системы на DRF;</li> <li>Развитие пользовательского интерфейса на Django templates + bootstrap;</li> <li>Упрощение процесса взаимодействия участников через расширение функционала телеграм-бота;</li> <li>Покрытие кода тестами.</li> </ul> <strong>Навыки, которые тебе точно понадобятся:</strong> <ul> <li>Python 3.12;</li> <li>Хорошее понимание и опыт с фреймворком Django;</li> <li>Навыки работы с HTML/CSS/Bootstrap (с шаблонизаторами Django/Jinja2);</li> <li>Опыт реализации REST API с Django REST Framework;</li> <li>Планирование задач с Celery + Redis;</li> <li>Командное использование системы контроля версий Github;</li> <li>Опыт написания тестов TestCase;</li> <li>Написание чистого кода с применением принципов SOLID, DRY;</li> <li>Навык работы с Docker;</li> <li>Знание/понимание принципа работы с aiogram/pytelebot.</li> </ul> <p><strong>А если владеешь этими навыками, то ты вообще крут (откликайся скорее):</strong></p> <ul> <li>Опыт работы с интеграциями сервисов;</li> <li>Агрегация запросов;</li> <li>Навык работы в команде ;</li> <li>Погруженность в процесс, интерес к финансовым структурам/блокчейну.</li> </ul> <p> </p> <p><strong>Что от нас:</strong></p> <ul> <li>Интересные ниши;</li> <li>Удаленный формат работы и гибкий график;</li> <li>Разносторонние задачи, которые помогут тебе профессионально развиваться;</li> <li>Открытые возможности роста;</li> <li>Современные стеки технологий.</li> <li>Возможность принимать решения самому.</li> </ul> <p> </p> <p> </p> <p>Интересно? Тогда откликайся скорее.</p> <p>У нас нет множества этапов собеседований, но для проверки hard skills используем тестовое задание.</p>",Микрокредитная компания БериРубли,https://hh.ru/employer/5760386,Полная занятость,От 1 года до 3 лет,True,2024-07-25T12:43:25+0300,False,2024-07-25T12:43:25+0300,100000.0,150000.0,RUR,Полный день,0,0,0.0,0.0
104754927,Разработчик,Екатеринбург,https://hh.ru/vacancy/104754927,True,False,"<p>О компании<br />ООО «Войсман» аккредитованная IT компания, является резидентом «Сколково» и Технопарка &quot;Университетский&quot;, основным продуктом компании, является разработанная нами голосовая технология для складской логистики. Нашими клиентами уже стали крупнейшие продуктовые ритейлеры, поставщики авто запчастей и транспортные компании. В данный момент мы активно растем, если Вам нравятся гибкие процессы, гибридный график работы, минимум бюрократии и люди, заряженные идеей, думаю нам с Вами по пути.</p> <p>В связи с развитием и ростом компании мы приглашаем в команду разработчика.</p> <p>Обязанности:</p> <ul> <li>Доработка и оптимизация backend-части приложения, адаптация SSR под CSR.</li> <li>Разработка frontend-части с использованием новых практик.</li> </ul> <p> </p> <p>Ключевые навыки:</p> <ul> <li>Умение работать в команде</li> <li>Знание ООП, DRY</li> <li>Владение Python, HTML, CSS, Javascript</li> <li>Знание Django, уверенное пользование Djano ORM,</li> <li>Знание DRF/Django Ninja/Flask/FastAPI будет плюсом</li> <li>Базовые знания SQL, PostgreSQL, включая views и routines</li> <li>Знание Typescript и работа с асинхронными запросами</li> <li>Опыт в фреймворках React/Vue/SolidJS будет плюсом</li> <li>Владение git, gitlab</li> <li>Базовые навыки в Linux (Ubuntu)<br /></li> </ul> <p><br />Условия:</p> <ul> <li>Возможность расти и развиваться в направлении разработки</li> </ul> <ul> <li>Первый месяц работа в офисе для погружения в специфику работы и обучения продукту, после предполагается удаленная работа.</li> </ul> <ul> <li>Официальное трудоустройство. Белая заработная плата, рассмотрим ожидания кандидатов.</li> <li>При желании всегда рады видеть Вас в нашем офисе в технопарке &quot;Университетский&quot;, г. Екатеринбург, ул. Конструкторов д. 5.<br />Минимум бюрократии, возможность участвовать в создании действительно востребованного и качественного продукта.</li> <li>Мы ориентированы на долгосрочное сотрудничество, перерастающее в дружбу.</li> </ul>",Войсман,https://hh.ru/employer/9832483,Полная занятость,От 1 года до 3 лет,False,2024-07-27T13:12:20+0300,False,2024-07-27T13:12:20+0300,0.0,0.0,0,Полный день,Екатеринбург,улица Конструкторов,56.834717,60.791897
103641114,Python-разработчик,Екатеринбург,https://hh.ru/vacancy/103641114,True,False,"<strong>Обязанности:</strong> <ul> <li> <p><strong>Автоматизация бизнес-процессов через API различных маркетплейсов (OZON, WB, Яндекс Маркет)</strong></p> </li> <li> <p><strong>Заниматься построением связей с данными парсинга поставщиков и маркетплейсами</strong></p> </li> <li> <p><strong>Поддержка уже настроенных ETL процессов, их доработка и создание новых</strong></p> </li> <li> <p><strong>Выполнять AdHoc задачи</strong></p> </li> </ul> <strong>Требования:</strong> <ul> <li> <p><strong>Владение Python 3.12</strong></p> </li> <li> <p><strong>Знание библиотек pandas, requests, BeautifulSoup, Selenium</strong></p> </li> <li> <p><strong>Знание основ Git</strong></p> </li> <li> <p><strong>Знание основ ETL</strong></p> </li> <li> <p><strong>Будут плюсом: навыки разработки баз данных</strong></p> </li> <li> <p><strong>Умение находить нетривиальные решения</strong></p> </li> <li> <p><strong>Умение самостоятельно определять сроки выполнения задачи исходя из собственных ресурсов</strong></p> </li> <li> <p><strong>Стремление к соблюдению PEP-8</strong></p> </li> <li> <p><strong>Опыт командной разработки</strong></p> </li> <li> <p><strong>Понимание механик работы на маркетплейсах</strong></p> </li> <li> <p><strong>Опыт работы с магазинами с большим количеством SKU</strong></p> </li> </ul> <strong>Условия:</strong> <ul> <li> <p><strong>Официальное оформление по ТК РФ.</strong></p> </li> <li> <p><strong>График работы 5/2.</strong></p> </li> <li> <p><strong>Стабильная выплата заработной платы 2 раза в месяц. </strong></p> </li> <li> <p><strong>Наставничество более опытного сотрудника поможет легко адаптироваться и интегрироваться в работу.</strong></p> </li> <li> <p><strong>Дресс-код &quot;Мне так удобно&quot;</strong></p> </li> </ul>",Теропром,https://hh.ru/employer/5372366,Полная занятость,Нет опыта,False,2024-07-10T11:39:47+0300,False,2024-07-10T11:39:47+0300,50000.0,150000.0,RUR,Полный день,Екатеринбург,улица Коминтерна,56.836584,60.654922
104152079,Python разработчик (Backend),Екатеринбург,https://hh.ru/vacancy/104152079,True,False,"<p>Мы занимаемся разработкой сервисов, обеспечивающих процесс автоматизированной медицинской диагностики. В нашу команду мы ищем разработчика с опытом Backend разработки на Python.</p> <p><strong>Задачи, которые предстоит решать:</strong></p> <ul> <li>&quot;заносить&quot; новые функциональности в имеющуюся кодовую базу;</li> <li>написание юнит и интеграционных тестов;</li> <li>участвовать в процессе деплоя, выполнять миграции, отслеживать работу сервисов;</li> <li>поддерживать версии зависимостей в актуальном состоянии.</li> </ul> <p><em>Приветствуется наличие и готовность показать код ранее выполненных проектов.</em></p> <p><strong>Требования:</strong></p> <ul> <li>опыт промышленной разработки backend приложений на Python не менее года;</li> <li>знание фреймворков FastApi, Django, SQLAlchemy;</li> <li>опыт работы с брокерами сообщений (RabbitMQ, Redis Streams);</li> <li>опыт работы с Docker, docker-compose, Nginx, Traefik;</li> <li>опыт работы с системами мониторинга и логирования: Prometheus, Grafana.</li> </ul> <p><strong>Со своей стороны, предлагаем:</strong></p> <ul> <li>рабочее место с производительным ПК.</li> <li>Оформление по ТК РФ.</li> <li>Офис в центре города в 5 мин. от м. Геологическая, в БЦ “Небо”.</li> </ul> <p><em>Уровень ЗП оговаривается с каждым кандидатом индивидуально.</em></p> <p> </p> <p><strong>О компании</strong></p> <p>Наша компания занимается развитием информационных систем в области анализа и компьютерной обработки медицинских данных (КТ, МРТ, ПЭТ). При содействии профильных медицинских учреждений в рамках экспертного сотрудничества решаются актуальные проблемы в области медицинской диагностики. Проводятся научно-исследовательские работы.</p> <p><strong>Наша компания занимается:</strong></p> <ul> <li>разработкой программного обеспечения, направленного на обработку и анализ результатов медицинской визуализации и иных данных, а также на автоматизацию процессов в области медицины;</li> <li>научно-исследовательской деятельностью;</li> <li>решением прикладных медицинских задач, совместно с профильными специалистами.</li> </ul> <p>Мы работаем над развитием экосистемы решений, включая: desktop приложения для работы с медицинскими изображениями и 3D графикой; web-технологии для обеспечения доступа к данным и выполнение их трансфера между пользователями; технологии компьютерного зрения в том числе с использованием machine learning при работе с медицинскими изображениями.</p>",АВА-мед-аналитика-мнение-анализ,https://hh.ru/employer/11042096,Полная занятость,От 1 года до 3 лет,False,2024-07-18T12:46:44+0300,False,2024-07-18T12:46:44+0300,0.0,0.0,0,Полный день,Екатеринбург,улица Народной Воли,56.826084,60.612395
