id,name,area,alternate_url,approved,archived,description,employer_name,employer_url,employment,experience,has_test,initial_created_at,premium,published_at,salary_from,salary_to,salary_currency,schedule,address_city,address_street,address_lat,address_lng
103651417,Python Developer,Екатеринбург,https://hh.ru/vacancy/103651417,True,False,"<p><strong>Nitka Technologies</strong>&#39;s developing software for customers in the US and Europe and brings together about 300 professionals from Eastern Europe, North and South America, Armenia, Georgia and Kazakhstan.</p> <p>We are looking for a <strong>Lead Engineer</strong> with robust full stack and architecture experience to join our dynamic fully distributed team.<br />The client - early-stage startup passionate about empowering small and medium-sized businesses to harness the power of AI for their business analytics.</p> <p><strong>Responsibilities</strong></p> <ul> <li>Lead the development and implementation of our product</li> <li>Learn and adapt to new technologies, particularly in the AI and data analytics space, integrate relevant technologies into our product, both commercial and open source systems like OpenAI and MistralAI</li> <li>Build and test AI Agents and integrate various tools for AI agents to use, including data processing, OCR and others</li> </ul> <p><strong>Skills required: </strong></p> <ul> <li>5+ years of experience in full stack development with a focus on software architecture</li> <li>Hands-on practical experience in system design, application development, testing and operational stability</li> <li>Strong back-end development experience with Python</li> <li>Experience with databases (SQL and NoSQL) and data modeling, including technologies such as PostgreSQL, MySQL, MongoDB, or Cassandra</li> <li>Familiarity with cloud platforms (AWS, Azure, Google Cloud) and containerization technologies (Docker, Kubernetes)</li> <li>Understanding or an ability to quickly learn AI/ML concepts and frameworks (e.g., TensorFlow, PyTorch, scikit-learn)</li> <li>Experience in data processing and ETL pipelines, solid understanding of traditional and modern data management techniques</li> <li>Experience with big data technologies such as Spark, Kafka</li> <li>Familiarity with data visualization tools (e.g., Tableau, Power BI, D3.js)</li> <li>Ability to work independently and willingness to make decisions and take responsibility</li> <li>Strong spoken and written english skills (Intermediate level and more)</li> </ul> <p><strong>Working conditions:</strong></p> <ul> <li>Remote work</li> <li>Full-time (8 hours/day)</li> <li>Interaction with a team from the USA</li> <li>Flexible schedule without time trackers</li> <li>Attractive USD compensation</li> <li>Paid vacation, holidays</li> </ul>","Nitka Technologies, Inc.",https://hh.ru/employer/9510458,Полная занятость,От 3 до 6 лет,False,2024-07-10T13:37:47+0300,False,2024-07-10T13:37:47+0300,0.0,0.0,0,Удаленная работа,0,0,0.0,0.0
103761994,Технический менеджер в команду capacity инфраструктуры,Екатеринбург,https://hh.ru/vacancy/103761994,True,False,"<p>Во внутренней инфраструктуре Яндекса больше ста тысяч серверов, на которых живут все наши сервисы. Команда capacity занимается управлением мощностями этих серверов: прогнозированием, перераспределением, внутренней тарификацией.</p> <p>Наша команда — это связующее звено между продуктовыми командами сервисов Яндекса, внутренними платформами Инфраструктуры, командой дата-центров и финансами. Управлять таким объёмом ресурсов нам помогают разрабатываемые в нашей команде процессы и программные решения.</p> <p><strong>Какие задачи вас ждут:</strong></p> <p><strong>Развитие заказа серверных ресурсов</strong><br />Сервисы Яндекса активно растут, и для поддержания их роста необходим регулярный приток новых ресурсов. Ключевая задача нашей команды — обеспечивать и развивать процесс заказа серверных ресурсов. Мы регулярно собираем требования к новым серверным ресурсам со всех подразделений Яндекса. Пересекаем эти требования с финансовыми рамками, возможностями дата-центров и прочими ограничениями физического мира. И после ряда внутренних переговоров получаем удовлетворяющий всех заказ на новые ресурсы, который обеспечит рост сервисов в следующем периоде. Мы постоянно совершенствуем этот процесс, чтобы успевать за ростом сервисов Яндекса и внешними изменениями.</p> <p> </p> <p><strong>Развитие процессов и инструментов управления ресурсами</strong><br />Работа с ресурсами не ограничивается регулярной выдачей заказов. Нужно как-то жить в промежутках между ними: уметь работать с дефицитом ресурсов, перераспределять их между сервисами, определять, какие сервисы используют ресурсы эффективнее, а какие нет, и так далее. В компании из тысяч разработчиков для этого приходится выстраивать специальные процессы и обеспечивать их поддержку организационно и инструментально. Например, нужны специальные люди, которые будут следить за использованием ресурсов в подразделениях, — capacity-планеры, и специальная система, в которой все пользователи ресурсов смогут легко управлять квотами на эти ресурсы. Наша задача — делать так, чтобы весь этот машинно-человеческий комплекс успешно работал, и улучшать его.</p> <p><strong>Развитие внутренних тарифов</strong><br />Внутренние тарифы дают ответы на ряд ключевых вопросов бизнеса Яндекса: как обеспечить окупаемость серверов, как оценить затраты на серверные ресурсы в бюджете бизнес-юнитов, как эффективней оптимизировать использование ресурсов сервисами. Наша команда совместно с командой финансов Инфраструктуры занимается развитием внутренних тарифов. В состав наших тарифов входит больше десяти внутренних провайдеров услуг, обеспечивающих сотни тарифицируемых услуг. Для качественного расчёта тарифов мы не только ведём активный диалог со всеми внутренними провайдерами, но и развиваем специальную систему автоматизированного расчёта тарифов, в которой сходится вся необходимая информация.</p> <p><strong>Мы ждём, что вы</strong></p> <ul> <li>Обладаете отличными навыками управления проектами, планирования и приоритизации задач</li> <li>Способны анализировать данные, извлекать ценные инсайты и принимать обоснованные решения</li> <li>Умеете расставлять приоритеты и решать задачи в срок</li> <li>Умеете управлять обсуждениями и фиксировать результаты</li> <li>Точно и внятно выражаете мысли устно и письменно, разговариваете с разработчиками на одном языке</li> <li>Умеете быстро погружаться в новое и не боитесь технических трудностей</li> <li>Понимаете, как устроено серверное оборудование для высоконагруженных систем</li> <li>Готовы погрузиться в тему управления серверными ресурсами и планирования их потребления</li> <li>Пишете на Python или любом другом языке программирования</li> </ul> <p><strong>Будет плюсом, если вы</strong></p> <ul> <li>Решали задачи по планированию потребления серверных ресурсов (capacity planning)</li> <li>Работали в финансовой сфере, знакомы с такими понятиями, как выручка, тарифы, CAPEX/OPEX, ROI/ROE</li> </ul>",Яндекс,https://hh.ru/employer/1740,Полная занятость,Более 6 лет,False,2024-07-12T10:11:02+0300,False,2024-07-12T10:11:02+0300,0.0,0.0,0,Полный день,0,0,0.0,0.0
103144108,Middle ML engineer ASR в команду клиентского сервиса,Екатеринбург,https://hh.ru/vacancy/103144108,True,False,"<p>Команда клиентского сервиса с использованием ML/DL создает инструменты для улучшения процессов взаимодействия с клиентами. В их числе средства анализа точек касания с клиентами и средства автоматизации внутренних процессов для пользы клиентов.</p> <p>Для решения задач распознавания речи (ASR/TTS) ищем разработчика-исследователя, который усилит нашу команду в этом направлении.</p> <p> </p> <div><strong>ЧЕМ ПРЕДСТОИТ ЗАНИМАТЬСЯ:</strong></div> <div> </div> <p>⁃ Разрабатывать и внедрять модели распознания речи (ASR/STT);</p> <p>⁃ Разрабатывать скрипты для создания датасетов и проведения бенчмарков моделей;</p> <p>⁃ Формировать и тестировать гипотезы;</p> <p>⁃ Заниматься профилированием моделей с использованием инструментов Nvidia и других.</p> <p> </p> <p><strong>МЫ ЖДЕМ, ЧТО ВЫ: </strong></p> <p>⁃ Имеете глубокие знания математики, алгоритмов, структур данных и статистики;</p> <p>⁃ Программируете на Python, R или подобных языках, умеете писать чистый код;</p> <p>⁃ Имеете экспертизу в технологиях ASR и последних достижениях в этой области;</p> <p>⁃ Работали с Whisper HF и методами ускорения;</p> <p>⁃ Умеете анализировать и оптимизировать алгоритмы пре- и пост-обработки аудио;</p> <p>⁃ Занимались обучением моделей ASR и оптимизацией для GPU/CPU;</p> <p>⁃ Имеете высшее образование в области математического моделирования/ информатики/ машинного обучения.</p> <p> </p> <p><strong>БУДЕТ ПЛЮСОМ, ЕСЛИ ВЫ: </strong></p> <p>⁃ Знаете принципы реализации биометрии по голосу, определения пола;</p> <p>⁃ Имеете экспертизу в диаризации спикеров в моно-канале;</p> <p>⁃ Решали задач NLP (кластеризация, классификация, LLM) и умеете упаковывать модели в REST-микросервис</p>",Газпромбанк,https://hh.ru/employer/3388,Полная занятость,От 1 года до 3 лет,False,2024-07-02T15:14:20+0300,False,2024-07-02T15:14:20+0300,0.0,0.0,0,Удаленная работа,0,0,0.0,0.0
97661958,Senior Data Scientist в команду антифрода,Екатеринбург,https://hh.ru/vacancy/97661958,True,False,"<p><strong>ЧЕМ БУДЕШЬ ЗАНИМАТЬСЯ?</strong></p> <ul> <li>Разрабатывать и внедрять моделей машинного обучения в проектах по борьбе с мошенничеством;</li> <li>Разрабатывать модели детектирования фрода: классификации, кластеризации, поиска аномалий;</li> <li>Рассчитывать экономический эффект от внедрения моделей;</li> <li>Готовить аналитические материалы, отчеты о разработке моделей;</li> <li>Принимать участие в подготовке и согласовании проектной документации на разработку;</li> <li>Проводить анализ различных источников данных, заниматься генерацией признаков для построения модели;</li> <li>Проверять гипотезы, проводить A/B тестирования;</li> <li>Заниматься комплексным анализом данных для выявления закономерностей и тенденций;</li> <li>Изучать новые технологии.</li> </ul> <p> </p> <p><strong>МЫ ЖДЕМ, ЧТО ВЫ: </strong></p> <ul> <li> <p>Строили рисковые модели;</p> </li> <li> <p>Имеете практический опыт полного цикла решения ML задачи: предобработка данных, выбор алгоритмов и тюнинг их параметров, оценка качества моделей, визуализация;</p> </li> <li> <p>Имеете степень бакалавра или магистра в области компьютерных наук, науки о данных, математики, статистики или смежных областях;</p> </li> <li>Работаете в области анализа данных и машинного обучения от 2 лет;</li> <li>Программируете на Python, R или подобных языках;</li> <li>Знаете SQL на уверенном уровне (вложенные запросы, оконные функции).</li> </ul> <p> </p> <p><strong>БУДЕТ ПЛЮСОМ, ЕСЛИ ВЫ: </strong></p> <ul> <li>Знаете и понимаете метрики, необходимые для оценки качества моделей;</li> <li>Работали с фреймворками PyTorch / TensorFlow;</li> <li>Работали с Linux, bash, системами контроля версий.</li> </ul> <p> </p> <strong>ЧТО МЫ ПРЕДЛАГАЕМ: </strong> <ul> <li>Достойный уровень вознаграждения;</li> <li>ДМС со стоматологией с первого месяца работы;</li> <li>Отпуск 33 дня + материальная помощь к отпуску;</li> <li>Полное соблюдение ТК РФ.</li> </ul>",Газпромбанк,https://hh.ru/employer/3388,Полная занятость,От 3 до 6 лет,False,2024-04-22T22:39:44+0300,False,2024-07-15T15:05:55+0300,0.0,0.0,0,Полный день,0,0,0.0,0.0
104528462,Менеджер по продажам,Екатеринбург,https://hh.ru/vacancy/104528462,True,False,"<p><strong>Skyeng</strong> — трендсеттеры в онлайн-образовании. Каждый год мы запускаем новые продукты и направления, выходим на интересные рынки (как в России, так и за границей), разрабатываем образовательные технологии и методики для сотен тысяч взрослых и детей.</p> <p>Мы конкурируем не с другими школами, а с Netflix, ютубом и залипательными играми. Боремся за внимание и время взрослых и детей. Наша цель — сделать онлайн-обучение захватывающим, понятным и человечным, даже если ученик осваивает Python или свойства логарифма. И, конечно, привести к результату, которым он будет гордиться и пользоваться.</p> <p>Но даже в Skyeng есть ученики, которым не хватило азарта и мотивации продолжать учиться. Сам же знаешь - эти вечные отговорки и “потом, потом, потом”. Если ты уверен, что сможешь вернуть этим ребятам тягу к знаниям и покажешь, что при желании твердый гранит науки рассыпается как песок — скорее к нам на позицию Awake-manager.</p> <p><strong>Чем предстоит заниматься:</strong></p> <ul> <li>Проводить дополнительное привлечение клиентов, уже использовавших услуги школы;</li> <li>Выявлять негативные факторы, влияющие на отказ от обучения и работать с ними;</li> <li>Работать с базой клиентов;</li> <li>Соблюдать бизнес-процессы компании, работать в CRM-системе и вести электронную отчетность.</li> </ul> <p><strong>Наш идеальный кандидат:</strong></p> <ul> <li>Имеет опыт работы от 6 месяцев удаленных продажах;</li> <li>Умеет выявлять потребности и использовать их при презентации клиенту;</li> <li>Эффективно использует техники отработки возражений, умеет слышать клиента и выявлять истинные потребности;</li> <li>Уверенный пользователь ПК;</li> <li>Обладает грамотной устной и письменной речью.</li> </ul> <p><br /><strong>Что мы предлагаем:</strong></p> <ul> <li> <p>Удаленную занятость из любой точки мира;</p> </li> <li>Удобный график оказания услуг - 9:00-18:00 или 10:00-19:00 по МСК, есть возможность выбрать подходящие дни oтдыха;</li> <li>Сильную и успешную команду, с которой не страшно браться за тяжелые задачи;</li> <li>Участие в тренингах с внешними/внутренними спикерами и других активностях внутри направления;</li> <li>Скидки до 50% на продукты компании для тебя, твоего друга или ребенка.</li> </ul> <div> <div> </div> <div> </div> </div>",Skyeng,https://hh.ru/employer/1122462,Полная занятость,От 1 года до 3 лет,False,2024-07-24T09:31:16+0300,False,2024-07-24T09:31:16+0300,55000.0,75000.0,RUR,Удаленная работа,0,0,0.0,0.0
