id,name,area,alternate_url,approved,archived,description,employer_name,employer_url,employment,experience,has_test,initial_created_at,premium,published_at,salary_from,salary_to,salary_currency,schedule,address_city,address_street,address_lat,address_lng
104053036,Ведущий Data Scientist,Екатеринбург,https://hh.ru/vacancy/104053036,True,False,"<p>Команда Центра компетенции &quot;Прогнозирование и модели операционного планирования&quot; занимающихся задачами прогнозирования временных рядов в поиске ведущего data scientist&#39;а.</p><h3><strong>Задачи</strong></h3> <ul> <li>Разрабатывать ML-модели предсказания временных рядов с учетом специфики бизнес-операций</li> <li>Исследовать логику бизнес-процессов, выделять основные составляющие элементы и драйвера и взаимосвязи между ними, предлагать математические модели увязки этих драйверов, выдвигать и проверять гипотезы по прогнозированию драйверов </li> <li>Поиск и подготовка данных для разрабатываемой модели </li> <li>Презентовать и защищать логику и метрики качества моделей перед проектной командой и заказчиками моделей</li> <li>Участвовать во внедрении в Пром разработанных моделей</li> <li>Проводить исследования в области прикладных математических алгоритмов и методов, используемых в задачах машинного обучения.</li> </ul><h3><strong>Требования</strong></h3> <ul> <li>Уверенный опыт применения методов машинного обучения для решения задач прогнозирования, реализованные проекты</li> <li>Понимание логики работы банковских продуктов</li> <li>Уверенные знания в области математической статистики, теории вероятностей, методов машинного обучения и анализа данных</li> <li>Умение грамотно структурировать и презентовать информацию</li> <li>Стек: Python, SQL</li> <li>Опыт работы с библиотеками: Sklearn, Pandas, Statsmodels, Xgboost/Lightgbm/Catboost, RandomForest.</li> </ul><h3><strong><strong>Условия</strong></strong></h3> <ul> <li>Официальное оформление с первого дня</li> <li>Офис в центре города. Пятидневная рабочая неделя с 9:00-18:00, в пятницу до 16:45</li> <li>Льготные условия кредитования</li> <li>ДМС с первого дня и льготное страхование для близких</li> <li>Бесплатная подписка СберПрайм+, скидки на продукты компаний-партнеров: Okko, Сбер Маркет, Delivery Club, Самокат, Сбер Еаптека и других</li> <li>Корпоративная пенсионная программа</li> <li>Обучение за счет компании: онлайн курсы в Виртуальной школе Сбера, возможность получить новую квалификацию</li> <li>Стабильный оклад и премии по итогам работы</li> <li>Корпоративный спортзал и скидки в спортзалы-партнеры (если есть на территории).</li> </ul>",СБЕР,https://hh.ru/employer/3529,Полная занятость,От 1 года до 3 лет,False,2024-07-17T10:08:00+0300,False,2024-07-17T10:08:00+0300,0.0,0.0,0,Полный день,0,0,0.0,0.0
104414175,Data Engineer,Екатеринбург,https://hh.ru/vacancy/104414175,True,False,"<p>АО «ЭнергосбыТ Плюс» объединенная энергосбытовая компания Группы &quot;Т Плюс&quot;: мы обеспечиваем светом и теплом около 7 миллионов домохозяйств в 16 регионах России.</p> <p>Приглашаем в нашу команду ДАТА-ИНЖЕНЕРА</p> <p><strong>Вам предстоит:</strong></p> <ul> <li> <p>Создание программного продукта в области данных (гарантирование доходов), его изменения, доработки</p> </li> <li> <p>Развитие и сопровождение действующего ETL-процесса</p> </li> <li> <p>Консультация технических и бизнес пользователей по вопросам процедур извлечения, обработки и наполнениями данными</p> </li> <li> <p>Участие в проектировании и реализация витрин данных</p> </li> </ul> <strong>Мы ожидаем от Вас:</strong> <ul> <li> <p>Опыт работы с базами данных, Python от года</p> </li> <li> <p>Знание языков программирования (Python, Sql)</p> </li> <li> <p>Опыт работы с Apache Airflow, SQLAlchemy</p> </li> <li> <p>Понимание архитектуры ХД (нормальные формы, модели хранения данных)</p> </li> <li> <p>Умение работать с загрузкой и выгрузкой больших объемов данных (инкрементальная, батч загрузка)</p> </li> <li> <p>Знание принципов работы OLTP, OLAP СУБД, объектных хранилищ данных</p> </li> </ul> <strong>Мы предлагаем:</strong> <ul> <li>Офис – г. Екатеринбург, ул. Кузнечная, д. 92</li> <li>Стабильный и прозрачный доход: базовый оклад + ежемесячная премия</li> <li>Поддержка в первые месяцы работы: наставник, который поможет освоиться в компании</li> <li>Выстроенная система обучения: тренинги и электронные курсы для самообразования и профессионального развития</li> <li>Забота о здоровье: программа ДМС, включая стоматологию</li> </ul> <p><strong>Тепло и свет – наша работа. Присоединяйтесь!</strong></p>",Т Плюс,https://hh.ru/employer/4073,Полная занятость,От 1 года до 3 лет,False,2024-07-23T09:09:17+0300,False,2024-07-23T09:09:17+0300,0.0,0.0,0,Полный день,Екатеринбург,Кузнечная улица,56.845972,60.620705
102858079,Старший разработчик DWH,Екатеринбург,https://hh.ru/vacancy/102858079,True,False,"<ul> </ul> <p><strong>Основные задачи:</strong></p> <ul> <li>Развитие и оптимизация корпоративного DWH;</li> <li>Проектирование и разработка логической и физической модели данных;</li> <li>Разработка и поддержка текущих ETL-процессов сбора данных, разработка проверок качества данных, интеграция новых источников;</li> <li>Определение возможностей для автоматизации и оптимизации процессов загрузки и обработки данных;</li> <li>Участие в тестирование разработанного функционала;</li> <li>Участие в подготовке планов группы, оценке трудоёмкости выполнения задач, рефакторинге витрин;</li> <li>Поиск и внедрение новых инструментов для работы команд разработки DWH.</li> </ul> <p><strong>Мы предлагаем:</strong></p> <ul> <li>Официальное трудоустройство в аккредитованный IT-актив компании, оплачиваемые отпуск, командировки, больничные, ДМС;</li> <li>Белую зарплату со своевременными выплатами 2 раза в месяц;</li> <li>Необходимые инструменты для удалённой работы из любой точки в формате &quot;Виртуальный офис&quot;;</li> <li>Возможность комбинированного режима в филиале города нашего присутствия;</li> <li>ДМС после прохождения испытательного срока;</li> <li>Яркую корпоративная жизнь, спортивные и кибертурниры;</li> <li>Корпоративные программы от наших партнеров (Samsung, Skyeng, МИФ, S7, X-Fit...);</li> <li>Бонусное подключение к телеком-услугам Дом.ru по тарифу «Сотрудник»;</li> <li>Дружелюбную атмосферу в коллективе профессионалов!</li> </ul> <p><strong>Ключевые навыки:</strong></p> <ul> <li>Умение проектировать базы данных;</li> <li>Знание OLAP- технологий;</li> <li>Знание современных технологий обработки данных и методологий построения DWH, процессов в области управления данными</li> <li>Уверенные знания sql, дополнительно можно рассматривать pl/sql;</li> <li>Опыт анализа и оптимизации sql-запросов;</li> <li>Опыт разработки ETL процессов загрузки данных с использованием любого промышленного инструмента;</li> <li>Разработка витрины данных на основе биллинговых или любых других ИС;</li> <li>Опыт успешной реализации проектов;</li> <li>Умение структурировать и систематизировать информацию;</li> <li>Самостоятельность, активная жизненная позиция.</li> </ul> <p><strong>Будет плюсом:</strong></p> <ul> <li>Знание Python, bash, опыт разработки микросервисов;</li> <li>Опыт разработки ETL процессов загрузки данных с использованием любого промышленного инструмента.</li> </ul>",ЭР-Телеком,https://hh.ru/employer/44272,Полная занятость,От 1 года до 3 лет,False,2024-06-27T14:46:48+0300,False,2024-07-09T12:51:43+0300,0.0,0.0,0,Удаленная работа,0,0,0.0,0.0
102074813,Маркетинговый аналитик (сервис Отелло),Екатеринбург,https://hh.ru/vacancy/102074813,True,False,"<p>В департамент маркетинга 2ГИС ищем маркетингового аналитика.</p> <p><strong>Задачи</strong></p> <ul> <li>Анализ маркетинговых активностей и их влияние на аудиторные метрики.</li> <li>Развитие системы сквозной аналитики.</li> <li>Взаимодействие с внутренними заказчиками для сбора требований к аналитическим отчетам и разработкой для их реализации.</li> <li>Разработка и поддержка аналитических отчетов (от сбора данных из БД до визуализации).</li> <li>Построение маркетинговых дашбордов с оценкой эффективности РК.</li> <li>Ad-Hoc запросы.</li> </ul> <p><strong>Мы ожидаем от вас</strong></p> <ul> <li>Знание и опыт работы c маркетинговыми метриками, оценкой маркетинговых компаний, понимание utm-меток, моделей атрибуции.</li> <li>Опыт работы с веб-аналитикой и/или аналитикой мобильных приложений.</li> <li>Опыт работы с BI-инструментами.</li> <li>Уверенный базовый SQL.</li> <li>MS Excel – уверенный пользователь (стандартные формулы и их комбинации, сводные таблицы, диаграммы).</li> <li>Умение работать с большим объемом информации, многозадачность, самостоятельность и инициативность.</li> </ul> <p><strong>Плюсом будет</strong></p> <ul> <li>Знание R/Python и желание их применять.</li> <li>Опыт работы с Apps Flyer / MyTracker / GA / Яндекс.Метрика.</li> <li>Построение моделей прогноза с использованием маркетинговых метрик.</li> </ul> <p><strong>Про работу в 2ГИС</strong></p> <ul> <li> <p>2ГИС — аккредитованная IT-компания.</p> </li> <li> <p>Трудоустройство с первого дня, полное соблюдение ТК РФ.</p> </li> <li> <p>Официальная заработная плата (оклад + бонусы).</p> </li> <li> <p>ДМС.</p> </li> <li> <p>Специальные условия по ипотеке от Сбера.</p> </li> <li> <p>Льготная IT-ипотека для всех сотрудников.</p> </li> <li> <p>СберПрайм+: доступ к 12 сервисам с выгодой до 3000 рублей в месяц.</p> </li> <li> <p>Льготы, бонусы и корпоративные скидки от партнёров компании.</p> </li> </ul>",2ГИС,https://hh.ru/employer/64174,Полная занятость,От 1 года до 3 лет,True,2024-06-17T10:28:48+0300,False,2024-07-06T16:10:34+0300,0.0,0.0,0,Удаленная работа,0,0,0.0,0.0
104419167,DevOps (Депозитарии),Екатеринбург,https://hh.ru/vacancy/104419167,True,False,"<p>Команда сопровождает системы Депозитария на Платформе поддержки развития бизнеса и Единой фронтальной системе, а также системы в каналах Сбербанк Онлайн и Сбербанк Онлайн Бизнес. Планируем, что новый сотрудник подключится к текущим задачам и будет готов поучаствовать в новых проектах.</p> <p><strong>Тебе предстоит:</strong></p> <ul> <li>лидировать функцию Devops в agile-команде</li> <li>поддержка/внедрение лучших практик непрерывной поставки и интеграции</li> <li>сопровождение текущей DevOps инфраструктуры проектов</li> <li>автоматизация развертывания</li> <li>выпуск релизов приложений с поддержкой на каждом этапе жизненного цикла DevOps</li> <li>организация работы и развитие систем мониторинга и логирования: Kibana, Prometheus/Grafana на базе Linux</li> <li>поддержка текущей инфраструктуры: администрированием серверов Linux и Jenkins</li> <li>обеспечивать соответствие политикам банка по деплойменту приложений.</li> </ul> <p><strong>Мы ожидаем от кандидата:</strong></p> <ul> <li>высшее техническое образование</li> <li>опыт написания темплейтов Openshift</li> <li>опыт работы с Istio Service Mesh</li> <li>знание жизненного цикла DevOps - CI, CDL, CDP</li> <li>знание основ сетевой инфраструктуры (балансировка, проксирование, порты и т.д.)</li> <li>знание основ информационной безопасности (сертификаты, VPN, TLS/SSL)</li> <li>хорошее знание Linux, опыт администрирования, написания shell скриптов</li> <li>опыт работы с инструментами Jenkins, на уровне написания своих pipeline’s</li> <li>опыт написания скриптов Ansible</li> <li>умение писать на одном из скриптовых языков groovy/python</li> <li>опыт работы с maven, gradle</li> <li>опыт работы с git/nexus</li> </ul> <p>Плюсом будет:</p> <ul> <li>понимание процессов тестирования: модульное, функциональное, интеграционное</li> <li>знание SQL, умение писать хотя бы простые скрипты</li> <li>опыт работы с Sonar или другими анализаторами кода</li> <li>опыт развертывания, настройки, администрирования систем мониторинга Prometheus/Grafana.</li> </ul> <p><strong>Условия:</strong></p> <ul> <li>работа в новом крутом технохабе в центре города</li> <li>режим работы офис фуллтайм либо смешанный (офис + дом)</li> <li>гибкое начало рабочего дня</li> <li>быструю адаптацию благодаря программам обучения</li> <li>команду Agile, готовую поддержать ваши инициативы</li> <li>ДМС доступен с первого дня работы</li> <li>льготные ставки по ипотеке «ДомКлик»</li> <li>льготные ставки по потребительским кредитам</li> <li>бесплатный тренажерный зал.</li> </ul>",СБЕР,https://hh.ru/employer/3529,Полная занятость,От 3 до 6 лет,False,2024-07-23T09:58:00+0300,False,2024-07-23T09:58:00+0300,0.0,0.0,0,Полный день,0,0,0.0,0.0
103688192,"Data Engineer (hadoop, spark)",Екатеринбург,https://hh.ru/vacancy/103688192,True,False,"<p>Мы - команда разработки Аналитической Платформы (АПЛ) розничного взыскания и урегулирования.</p> <p>Создаем, внедряем, сопровождаем и развиваем <strong>дата-продукты</strong> для наших внутренних клиентов:</p> <p>в дивизионе в ЦА, в территориальных банках, головных отделениях, центрах ПЦП.</p> <p>Что это за дата-продукты?</p> <p>Это и готовые BI решения, на которых конструируем <strong>BI дашборды</strong>,</p> <p>это и свои уникальные аналитические <strong>веб-приложения</strong>, ценность и полезность которых находит отражение:</p> <p>- в стабильном росте активных пользователей (100 человек в 2020 г. и &gt; 3000 сейчас);</p> <p>- в оценках удовлетворенности CSI - на уровне выше ожиданий.</p> <p>Под капотом у этих продуктов в качестве СУБД была и пока остается СУБД Oracle,</p> <p>но в рамках импортозамещения - принято решение по <strong>миграции с Oracle на Hadoop и Greenplum</strong>,</p> <p>с последующим развитием нового аналитического слоя хранилища данных, построения новых интеграционных процессов/взаимодействия</p> <p>между источниками данных в корпоративно аналитической платформе банка КАП, построение витрин данных на Greenplum в ПКАП платформы дивизиона.</p> <p><strong>Цель</strong>: пользователь не замечает разницы и продолжает пользоваться продуктами, получать привычную ценность и пользу</p> <p>и при последующем развитии - находит новые точки роста, улучшает свою эффективность и результат.</p> <p>Именно для этих целей - <strong>мы ищем дата инженера</strong>, вовлеченного в решение подобного рода задач.</p> <p>Плюсом будет релевантный опыт таких миграций/настроек потоков данных и их обработки/разработки ETL-процессов.</p> <p><strong>Обязанности</strong></p> <ul> <li>Проектирование, разработка и поддержка инфраструктуры для хранения и обработки больших данных;</li> <li>Проектирование и разработка ETL-процессов, используя внутренние и внешние источники данных для NRT и Batch поставок данных;</li> <li>Проектирование и настройка систем отчетности для разовых и периодических выгрузок данных для внутренних и внешних заказчиков</li> </ul> <p><strong>Требования</strong></p> <ul> <li>Опыт разработки на Java / Python / Scala не менее 3 лет;</li> <li>Опыт в написании функций для первичной обработки, преобразования и агрегации данных на одном из или нескольких вышеуказанных языках;</li> <li>Опыт разработки в экосистеме Hadoop (HDFS, YARN, Оркестраторы);</li> <li>Хорошие знания фреймворка Spark; Базовый опыт оптимизации запросов;</li> <li>Опыт разработки в SQL (Oracle, PostgreSQL, Greenplum) и NoSQL (Hive, Impala);</li> <li>Опыт в создании алгоритмов загрузки данных в витрины с учётом историчности, уникальности, логики обновления таблиц;</li> <li>Хорошие знание SQL (понимание от чего зависит оптимальность запроса; умение разбираться в сложных аналитических запросах);</li> <li>Уверенные знания теории DWH;</li> <li>Опыт работы с CI/CD решениями на базе Jenkins и Bitbucket/Git;</li> </ul> <p><strong>Условия</strong></p> <ul> <li>Стабильную белую заработную плату и годовую премию, с возможностью получить повышенную премию;</li> <li>Работа с передовым техническим стеком;</li> <li>Бесплатное обучение в лучшем корпоративном университете и возможность проходить внешнее обучение за счет компании;</li> <li>Льготные условия по ипотеке;</li> <li>ДМС с первого рабочего дня в современных клиниках, с возможностью прикрепления родственников к программе.</li> </ul>",СБЕР,https://hh.ru/employer/3529,Полная занятость,От 1 года до 3 лет,False,2024-07-11T09:27:00+0300,False,2024-07-11T09:27:00+0300,0.0,0.0,0,Полный день,0,0,0.0,0.0
