id,name,area,alternate_url,approved,archived,description,employer_name,employer_url,employment,experience,has_test,initial_created_at,premium,published_at,salary_from,salary_to,salary_currency,schedule,address_city,address_street,address_lat,address_lng
96536277,Python developer / Разработчик Python (KORNFELD),Екатеринбург,https://hh.ru/vacancy/96536277,True,False,"<p>Мы активно расширяем портфель наших продуктов, в связи с чем открываем поиск <strong>Python разработчика </strong>в команду разработки сетевого ethernet-коммутатора (L2/L3) Kornfeld.<br /></p> <p>Kornfeld - это семейство высокопроизводительных коммутаторов для центров обработки данных, поддерживающих на аппаратном уровне обработку трафика L2/L3 и технологии сетевой виртуализации.<br /></p> <p><em><strong>Чем предстоит заниматься:</strong></em></p> <ul> <li>разработкой встроенного программного обеспечения сетевых ethernet-коммутаторов;</li> <li>проводить анализ программных решений с открытым кодом из предметной области;</li> <li>дорабатывать, осуществлять рефакторинг используемых программных решений с открытым кодом (в настоящее время код на Python составляет до 30% от общего объема);</li> <li>в составе команды разрабатывать с нуля внутреннюю систему мониторинга оборудования и программного обеспечения сетевых коммутаторов;</li> <li>разрабатывать элементы системы управления как периферийным оборудованием коммутаторов так и коммутаторами в целом.<br /></li> </ul> <p><em><strong>Мы ожидаем от будущего члена команды:</strong></em></p> <ul> <li>уверенное владение Python3 в области сетевого программирования (sockets);</li> <li>знание сетевых технологий, стека протоколов TCP/IP + представление о модели OSI;</li> <li>знание сетевых протоколов управления (SNMP, NETCONF, RESTCONF), маршрутизации (RIP, OSPF, BGP) и др.</li> <li>отличное знание Linux, опыт разработки приложений под Linux/Unix;</li> <li>знание bash.<br /></li> </ul> <p><em><strong>Будет плюсом:</strong></em></p> <ul> <li>опыт работы с RPC-протоколами (JSON-RPC, gRPC), REST;</li> <li>опыт работы с форматами данных JSON, XML, YAML;</li> <li>опыт написания unit-тестов с использованием pytest;</li> <li>опыт асинхронного программирования (asyncio);</li> <li>опыт написания документации с использованием фреймворка Sphinx;</li> <li>опыт написания парсеров для структурированных файлов.</li> <li>опыт работы с Docker контейнерами.</li> </ul>",YADRO,https://hh.ru/employer/1993194,Полная занятость,От 3 до 6 лет,False,2024-04-09T15:38:15+0300,False,2024-07-08T15:38:18+0300,0.0,0.0,0,Полный день,0,0,0.0,0.0
104013024,Аналитик маркетплейсов,Екатеринбург,https://hh.ru/vacancy/104013024,True,False,"<p><strong>Компания Viarubi, лидер по продажам бижутерии на Маркетплейсах Wildberries и Ozon. И сейчас мы в поисках Аналитика.</strong></p> <p>Мы мыслим оригинально, генерируем идеи и самое главное воплощаем их в жизнь. Мы строим команду из людей, которые не боятся рисковать и действовать, ведь главное видеть и идти к своей цели!</p> <p>Наш проект — это уникальная возможность раскрыть свой потенциал и стать частью большой дружной команды.</p> <p><strong>Мы предлагаем:</strong></p> <ul> <li>Работу в стабильной компании, возможность расти с нами как профессионально так и финансово</li> <li>Заработная плата 50000-70000 руб, согласовывается с успешным кандидатом на собеседовании.</li> <li>Мы демократичная компания, где каждый имеет право иметь свою точку зрения. Администрация всегда рада, если вы придете со своими идеями, пожеланиями или проблемами, именно благодаря открытости к диалогу мы становимся все сильнее и лучше.</li> <li>Мы поощряем желание коллег становиться лучше, поэтому всем доступна База знаний на корпоративном портале. А также есть возможность проходить крутые тренинги, которые оплачивает компания. Есть все возможности карьерного роста.</li> <li>Удаленная работа</li> </ul> <strong>Что нужно делать:</strong> <ul> <li>Исследовать тренды и спрос на товары</li> <li>Аналитические отчеты, для выявления обладающий наибольшей покупательской способностью.</li> <li>Аналитика продаж товаров на маркетплейсах.</li> <li>Формирование гипотез по развитию продаж (категории, подкатегории товаров).<br />Анализ цен конкурентов с дальнейшими предложениями по ценообразованию.<br />Проведение исследований, изучение узких мест продуктовой воронки, поиски точек роста;</li> <li>Подготовка управленческой отчетности для собственника</li> </ul> <strong>Мы ждем от тебя:</strong> <ul> <li>Желание развиваться: готовность учиться новому и совершенствовать свои навыки в анализе данных;</li> <li>Умение работать с Excel/Google таблицами: знаешь самые распространенные формулы и можешь создавать сводные таблицы;</li> <li>Опыт работы аналитиком от 6 месяцев</li> <li>Опыт работы с маркетплейсами будет огромным преимуществом!</li> <li>Умение работать с Excel/Google таблицами: знаешь самые распространенные формулы и можешь создавать сводные таблицы</li> <li>Внимательность: умение замечать малейшие отклонения в данных;</li> <li>Аналитический склад ума;;</li> <li>Усидчивость и готовность к большому объему работы</li> </ul> <p><strong>Будет круто, если ты владеешь:</strong></p> <ul> <li>Google sheets, Excel;</li> <li>умение работать с Api;</li> <li>Владение сервисами аналитики (MPStats, Wildbox и др.);</li> <li>Методы анализа и статистики;</li> <li>Владение инструментами веб аналитики (Яндекс Метрикой, Google analytics, GTM);</li> <li>Умение работать с большими массивами данных от 5000 SKU</li> <li>Желательно знание SQL, Python;</li> <li>Желательно опыт разработки дашбордов в Power Bi</li> </ul> <p><strong>Будет здорово, если в сопроводительном письме Вы укажите, был ли у вас опыт работы с маркетплейсами и с какими площадками!</strong></p>",Rubi.by,https://hh.ru/employer/10803639,Полная занятость,От 1 года до 3 лет,False,2024-07-16T17:11:23+0300,False,2024-07-16T17:11:23+0300,50000.0,70000.0,RUR,Удаленная работа,0,0,0.0,0.0
103230211,Тестировщик Процессингового центра (Екатеринбург),Екатеринбург,https://hh.ru/vacancy/103230211,True,False,"<p>Привет!</p> <p>Мы - банковская группа Синара ищем в команду <strong>Тестировщика (QA)</strong> для работы над интересными и сложными проектами, развивающими мир финтех.</p> <p><strong>АО Банк Синара</strong> — один из крупнейших региональных российских банков (ранее – СКБ-Банк), в ноябре 2020 года отметил тридцатилетие. Банк входит в финансово-промышленный холдинг Группа Синара, который объединяет 45 предприятий и 32 000 сотрудников.</p> <p>Слаженная команда IT-профессионалов Банка Синара самостоятельно разрабатывает и сопровождает финансовые сервисы для обслуживания клиентов онлайн и в офисах банка.</p> <p>Мы используем самые передовые инструменты разработки, работаем по Agile, помогаем команде расти, инвестируем в своих сотрудников и ценим вклад каждого.</p> <p>Если Вы хотите попасть в крутую команду профессионалов, работать и развиваться вместе в сообществе – наше предложение о работе то, что Вы искали.</p> <p><strong>Какие будут задачи?</strong></p> <ul> <li> <p>Тестирование с использованием устройств самообслуживания (АТМ, терминалы), симуляторов платежных систем;</p> </li> <li> <p>Проверка корректности проведения карточных авторизаций, проведения клиринговых расчётов;</p> </li> <li> <p>Регрессионное, функциональное тестирование;</p> </li> <li> <p>Тестировать ПО в ручном режиме с использованием различных инструментов;</p> </li> <li> <p>Ведение тестовой документации (составление тест-кейсов, тест-планов, чек-листов и т.д.;</p> </li> <li> <p>Регистрация ошибок в баг-трекинговой системе.</p> </li> </ul> <p><strong>Что для нас важно:</strong></p> <ul> <li> <p>Знание фундаментальных основ тестирования;</p> </li> <li>Опыт тестирования ПО, QA, QC;</li> <li>Понимание основных принципов работы БД, знание основ SQL, основ языка хранимых процедур БД;</li> <li>Знание модели OSI, опыт работы с протоколами прикладного уровня – SOAP, HTTP, FTP;</li> <li>Навыки работы с инструментами тестирования(Fiddler/JMeter/PostMan), опыт UI Testing и т.д.</li> <li>Понимание принципов работы брокеров очередей сообщений;</li> <li>Знание технологий XML (XSLT, XSD);</li> <li>Функциональное тестирование;</li> <li>Регресcионное тестирование;</li> <li>Нагрузочное тестирование;</li> <li>Знание офисного пакета ПО (MS Word, MS Outlook, MS Excel, MS PowerPoint).</li> </ul> <p><strong>Ваши преимущества:</strong></p> <ul> <li>Oracle PL/SQL;</li> <li>Умение автоматизировать рутинные процедуры с помощью какого-либо скриптового языка программирования (Python и т.п.);</li> <li>Опыт организации и развития автоматического тестирования;</li> <li>Английский на уровне чтения технических документов;</li> <li>Опыт работы в сфере платежных систем Visa, Mastercard, МИР;</li> <li>Понимание специфики работы системы электронных расчетов с использованием банковских карт;</li> <li>Знание технологий работы устройств самообслуживания.</li> </ul> <p><strong>Какие условия мы предлагаем:</strong></p> <ul> <li><strong>Официальное трудоустройство.</strong> Полностью белая заработная плата со всеми налоговыми отчислениями.</li> <li><strong>Достойная оплата.</strong> Оговариваем по результатам собеседования, основываясь на ваши технические навыки и ожидания.</li> <li><strong>Заботимся о здоровье. </strong>ДМС после прохождения испытательного срока.</li> <li><strong>Рост.</strong> Профессиональное обучение, возможность повышения квалификации. Карьерный рост зависит от твоего развития внутри компании.</li> <li><strong>Увлекательная корпоративная жизнь:</strong> конкурсы, спортивные мероприятия, корпоративы, возможность заработать брендированную продукцию.</li> <li><strong>Комфорт работы.</strong> Обеспечим хорошим рабочим местом в офисе с печеньками и кофе или можете оставаться работать из дома (&quot;гибрид&quot;)</li> </ul>",Банк Синара,https://hh.ru/employer/33305,Полная занятость,От 1 года до 3 лет,False,2024-07-03T15:46:49+0300,False,2024-07-03T15:46:49+0300,0.0,0.0,0,Полный день,Екатеринбург,Красноармейская улица,56.834575,60.616555
87842943,Технический директор/СТО,Екатеринбург,https://hh.ru/vacancy/87842943,True,False,"<p><strong>Компания «Биллинг Онлайн Решения» — IT компания, входящая в состав Группы Компаний QIWI. Мы — разработчик запатентованных сервисов комплексной автоматизации бизнес-процессов в ЖКХ на базе единой Облачной платформы «Биллинг Эксперт».</strong></p> <p><strong>Если проще: мы создали продукты, благодаря которым людям удобно оплачивать услуги ЖКХ и подавать заявки в гос. компании на изменения в городе. А также связали все системы с муниципальным управлением и управляющими компаниями, и дали им it решение для эффективной работы.</strong></p> <p><strong>Чем ты будешь заниматься:</strong></p> <ul> <li>Определение стратегии развития технологий компании;</li> <li>Поддержание и развитие технической и программной архитектуры\инфраструктуры, технологий компании;</li> <li>Управление техническим бэклогом;</li> <li>Обеспечение команд современными инструментами и подходами к управлению бэклогом задач (Agile, Kanban, Scrum);</li> <li>Участие в поддержании системы управления безопасностью бизнеса;</li> <li>Управление командой разработчиков (до 20 человек);</li> <li>Управление бизнес-бэклогом, прямое взаимодействие с различными департаментами головной компании Qiwi</li> </ul> <p><strong>Как понять, что ты подходишь</strong><strong>:</strong></p> <ul> <li>Опыт работы руководителем в IT от 3 лет;</li> <li>Опыт работы с языками программирования Python/PHP;</li> <li>Понимание принципов ООП, практик проектирования сервисов и архитектурных паттернов;</li> <li>Опыт управления программистами (постановка задач, контроль, приемка результата);</li> <li>Знание основ проектного управления (Agile, Scrum, Kanban);</li> <li>Высокий уровень коммуникативных навыков, умение вести переговоры;</li> <li>Умение работать в режиме многозадачности</li> </ul> <p><strong>Наш стэк:</strong></p> <ul> <li>Python (FastApi, Django),</li> <li>PHP (Yii Framework),</li> <li>DevOps (Docker, Docker Swarm, GitLab CI\CD, Ansible),</li> <li>FrontEnd (React + TS),</li> <li>Mobile (React Native, Flutter),</li> <li>QA (Pytest, PHPUnit, Codeception)</li> </ul> <p><strong>Мы предлагаем:</strong></p> <ul> <li>Официальный статус ИТ-компании;</li> <li>Оформление по ТК РФ, &quot;белую” заработную плату;</li> <li>ДМС после полугода работы;</li> <li>График работы 5/2 (начало рабочего дня обсудим);</li> <li>Уникальную атмосферу для продуктивной работы и развивающую среду, где можно найти единомышленников и научиться новому;</li> <li>Офис в Центре города</li> </ul>",QIWI,https://hh.ru/employer/3125,Полная занятость,От 3 до 6 лет,False,2023-10-06T14:57:40+0300,False,2024-07-17T11:21:57+0300,0.0,0.0,0,Полный день,Екатеринбург,улица Шейнкмана,56.822651,60.590504
103683869,DevOps - инженер / Инженер сопровождения,Екатеринбург,https://hh.ru/vacancy/103683869,True,False,"<p>О нас: мы – команда поддержки инфраструктуры и поставки сервисов кибербезопасности Сбера. Мы наращиваем команду, чтобы активно развивать продукты, которые работают на благо общества и ищем профессионала своего дела, который проникнется нашими идеями и целями.</p> <p>Наш передовой технологический стек:</p> <p>Big Data - Hadoop, Scala, Spark, Casandra, Elasticsearch</p> <p>CI/CD - Jenkins, Maven, Ansible, Helm </p> <p>Monitoring - Grafana, Zabbix, Prometheus</p> <p>DevOps - OpenShift, BitBucket, Docker, Ansible, Git</p><h3><strong>Задачи для тебя:</strong></h3> <ul> <li>поддержка и развитие автоматизированной системы и её сервисов</li> <li>релиз-менеджмент: сопровождение релизов, проведение приёмо-сдаточных испытаний, установка дистрибутивов на промышленые стенды</li> <li>сопровождение приложений кластеров: Hadoop, Apache Nifi, OpenShift, ClickHouse, Flink</li> <li>автоматизация процессов взаимодействия с DEV/TEST/PSI/PROM средами (Ansible) • Работа с ITSM процессами</li> <li>устранение рисков кибербезопасности</li> <li>развитие мониторинга системы</li> <li>разработка и поддержка процессов CI/CD, деплой приложений в OpenShift автоматизация процессов сборки, развёртывания, написание Jenkins Pipeline</li> <li>участие в проектировании и разработке процессов DevOps</li> <li>разработка helm-chart</li> </ul><h3><strong>Важно для нас:</strong></h3> <ul> <li>опыт работы с OS Linux (RHEL 7.Х/8.X - предпочтительно)</li> <li>понимание современных DevOps-концепций и опыт использования средств автоматизации DevOps</li> <li>понимание принципов виртуализации</li> <li>опыт работы с Helm</li> <li>опыт работы с GIT/Nexus, Atlassian стеком (BitBucket, Jira, Confluence) </li> </ul> <p>Будет плюсом:</p> <ul> <li>владение скриптовыми языками программирования (Bash, Ansible, Python, Groovy...)</li> <li>опыт работы с контейнерными приложениями</li> <li>опыт работы с кластерами Kafka, Ni-Fi, Flink, Hadoop, ClickHouse и их тонкой настройки</li> <li>опыт работы с базами данных, написание SQL запросов</li> <li>опыт работы с системами мониторинга Zabbix, Graphana, Prometheus</li> </ul><h3><strong>Мы предлагаем:</strong></h3> <ul> <li>возможность использовать в практике наиболее востребованные на рынке open source решения в области Big Data и микросервисной архитектуры</li> <li>инновационные, амбициозные проекты и задачи, которые развивают: всегда есть возможность прокачать свои навыки в работе и профессионально расти.</li> <li>погружение в среду обмена знаниями благодаря высокой экспертизе внутри команды</li> <li>стабильную заработную плату и приятный годовой бонус.</li> <li>современный IT-офис с фитнес-залом.</li> </ul>",СБЕР,https://hh.ru/employer/3529,Полная занятость,От 1 года до 3 лет,False,2024-07-11T08:22:00+0300,False,2024-07-11T08:22:00+0300,0.0,0.0,0,Полный день,0,0,0.0,0.0
